{
  "authors": {
    "Ada Lovelace": 3,
    "Grace Hopper": 2,
    "Katherine Johnson": 1
  },
  "by_type": {
    "chore": 1,
    "docs": 1,
    "feat": 2,
    "fix": 2
  },
  "commit_count": 6,
  "first_date": "2026-01-05",
  "generated_at": "2026-08-19T14:23:50.940296+00:00",
  "last_date": "2026-01-12",
  "unique_authors": 3
}
